nama_bisnis,kategori,rating,jumlah_ulasan,no_telepon,website,alamat
Last Minutes Pool and Bistro,Kafe,4.8,87,6281703567677,https://www.instagram.com/invites/contact/?i=1ewfcjfji7bcb&utm_content=nqat60t," Jl. Gatot Subroto No.26 kavling 3&4, Kampungtengah, Kepatihan, Kec. Kaliwates, Kabupaten Jember, Jawa Timur"
Bourju Pool and Bistro BPB,Tempat Biliar,4.7,133,628978787869,https://linktr.ee/bourjupoolandbistro," KFC, Jl. Gajah Mada No.74 LT.2, Kb. Kidul, Jember Kidul, Kec. Kaliwates, Kabupaten Jember, Jawa Timur 68131"
TIGER POOL & BISTRO,Tempat Biliar,4.9,124,6285198893838,0," RMCC+RXP, Kaliwates, Kec. Kaliwates, Kabupaten Jember, Jawa Timur 68131"
Eight Pool,Tempat Biliar,4.9,28,6282337655613,https://linktr.ee/tenballbilliard," Perumahan the argopuro No.35, Kaliwates Kidul, Kaliwates, Kec. Kaliwates, Kabupaten Jember, Jawa Timur 68131"
Ten Ball Billiard Jember,Klub Biliar,5.0,6,628998101010,https://linktr.ee/tenballbilliard," Jl. Diponegoro No.102 Ruko 3 Lantai, Tembaan, Kepatihan, Kec. Kaliwates, Kabupaten Jember, Jawa Timur 68137"
Black Diamond Pool & Cafe,Tempat Biliar,4.6,13,6281216744743,0," Jl. Kaca Piring No.152, Gebang Tengah, Gebang, Kec. Patrang, Kabupaten Jember, Jawa Timur 68117"
Hawk Eye Pool & Cafe Minsitthar,Toko Perlengkapan Biliar,4.2,22,,0," Jl. Panjaitan No.163, Gumuk Kerang, Sumbersari, Kec. Sumbersari, Kabupaten Jember, Jawa Timur 68121"
BS POOL (CAFE & BILLIARD),Tempat Biliar,4.3,26,6282333885541,0," Krajan, Manggisan, Kec. Tanggul, Kabupaten Jember, Jawa Timur 68155"
Break Shot Billiard (Balung),Arena,3.9,7,6285136553788,0," Jl. Ambulu No.6, Wetan Kali, Balung Lor, Kec. Balung, Kabupaten Jember, Jawa Timur 68161"
Mac Billiard,Tempat Biliar,5.0,4,6282233800078,0," Jl. Jayanegara No.10D, Patimura, Jember Kidul, Kec. Kaliwates, Kabupaten Jember, Jawa Timur 68131"
TRIPLE BILLIARD,Klub Biliar,5.0,1,6285784113382,https://www.instagram.com/triple.billiard/profilecard/?igsh=MWxtNDVteHpmYm0wcQ==," Jl. Gn. Kerinci Jl. Tidar, Kloncing, Karangrejo, Kec. Sumbersari, Kabupaten Jember, Jawa Timur 68121"
MAYBE CAFE & BILLIARD,Kedai Kopi,4.8,37,6285755841501,0," Jalan Tanggul, Ponjen, Kencong, Jember Regency, East Java"
MACAU BILLIARD & CAFE,Tempat Biliar,4.0,16,6285168640002,0," Jl. Diponegoro, Pattian, Kotakulon, Kec. Bondowoso, Kabupaten Bondowoso, Jawa Timur 68219"
9 Master Pool & Cafe [MPC],Kafe,4.4,5,,0," Jl. Tidar, Kali Oktak, Karangrejo, Kec. Sumbersari, Kabupaten Jember, Jawa Timur 68124"
Putra Billiard Jember,Klub Olahraga,5.0,2,62811301843,0," Jl. Kerta Negara VII No.105, Kelurahan Jember Kidu, Jember Kidul, Kec. Kaliwates, Kabupaten Jember, Jawa Timur 68131"
JnC Resto and Pool,Klub Biliar,4.6,114,6282228422284,http://www.jncpool.com/," Jl. Hayam Wuruk No.9, Jati, Kec. Mayangan, Kota Probolinggo, Jawa Timur 67217"
D'GREY CORNER BILLIARD,Klub Olahraga,5.0,2,6282231423122,0," Jln. Raya Kraton No.4, Krajan I, Jombang, Kec. Kencong, Kabupaten Jember, Jawa Timur 68167"
University Billiard,Klub Biliar,5.0,1,6281357773640,0," JL. Semeru B1A, Kabupaten Jember, Jawa Timur"
RENZ Billiard & Cafe,Klub Olahraga,3.5,4,6285258838664,0," Jl. Letnan Sudiono No.5, Kali Nangkaan, Dabasah, Kec. Bondowoso, Kabupaten Bondowoso, Jawa Timur 68211"
ESENJE billiard & cafe,Dapur Umum,3.5,4,6282229758375,0," Jl. Watu Ulo No.99, Bedengan, Tegalsari, Kec. Ambulu, Kabupaten Jember, Jawa Timur 68172"
Porta Pool & Bistro,Pusat Hiburan,4.4,60,6287841400259,0," Jl. DR. Sutomo No.15, Lumbung, Badean, Kec. Bondowoso, Kabupaten Bondowoso, Jawa Timur 62814"
Zi-O Billiard & Cafe,Kafe,5.0,8,,0," RQXX+W6M, Jl. Kalisat-Mayang, Krajan III, Glagahwero, Kec. Kalisat, Kabupaten Jember, Jawa Timur 68181"
NBS (Navdeep Billiard Sport),Tempat Biliar,4.8,5,6285749079757,0," Jl. Raya Besuki, Desa Poncogati Kec. Curahdami, Kec. Bondowoso, Kabupaten Bondowoso, Jawa Timur 68250"
Billiard Basecamp,Klub permainan papan,5.0,2,6282229650572,0," jl. riau 15GG, Krajan Barat, Sumbersari, Kabupaten Jember, Jawa Timur 68121"
Renes Billiard and Cafe,Kafetaria,5.0,1,6282229650572,0," Jl. Ahmad Yani, RT.001/RW.016, Langon, Ambulu, Kec. Ambulu, Kabupaten Jember, Jawa Timur 68172"
Omah billiard,Klub Olahraga,0.0,0,6289661477070,0," VPJX+6C8, Jl. Sultan Agung, Krajan, Arjasa, Kec. Arjasa, Kabupaten Jember, Jawa Timur 68191"
Billiard Sporty Club (BSC),Gudang,0.0,0,6285895165769,0," Jl. Raya Wringin No.2, Wringin Ps., Wringin, Kec. Wringin, Kabupaten Bondowoso, Jawa Timur 68252"
Mac Coffee Jember,Restoran,4.8,48,6282233800078,0," Jl. Jayanegara No.10F, Patimura, Jember Kidul, Kec. Kaliwates, Kabupaten Jember, Jawa Timur 68131"
BONANZA CAFE & BILLIARD,Kedai Kopi,4.9,9,6285964416174,0," 5XQG+G87, Jl. Pancur, Sumpelan Utara, Lumutan, Kec. Prajekan, Kabupaten Bondowoso, Jawa Timur 68284"
Follow billiard,Kantor Perusahaan,2.0,8,,0," Jl. Tidar No.138, Kloncing, Karangrejo, Kec. Sumbersari, Kabupaten Jember, Jawa Timur 68124"
CAFBIL cafe&billiard,Kafe,4.4,9,6282232691999,0," Unnamed Road, Darungan, Sawaran Kulon, Kec. Kedungjajang, Kabupaten Lumajang, Jawa Timur 67358"
NAKAMA Cafe & Billiard,Kafe,5.0,2,6287720570865,0," Jl. R.A. Kartini No.265, Samsari, Wonorejo, Kec. Kencong, Kabupaten Jember, Jawa Timur 68167"
ALDO CAFE & BILLIARD,Tempat Biliar,5.0,2,6281359403100,0," Jl. Banyuwangi, Krajan, Garahan, Kec. Silo, Kabupaten Jember, Jawa Timur 68184"
Hexo Billiard [HELCURT],Tempat Biliar,4.0,2,,0," Jalan Nasional, Tekoan, Tanggul Kulon, Kec. Tanggul, Kabupaten Jember, Jawa Timur"
KFC Raceway,Arena Bermain Anak-Anak,5.0,1,,http://www.javalotishotel.com/," Jl. Gajah Mada No.103, Kelurahan Jember Kidu, Jember Kidul, Kec. Kaliwates, Kabupaten Jember, Jawa Timur 68131"
Sky Lounge Jember,Lounge,4.6,11,6281130590777,http://www.javalotishotel.com/," Jalan Jendral Jl. Gatot Subroto No.47, Tembaan, Kepatihan, Kaliwates, Jember Regency, East Java 68131"
prince billiard and resto,Dapur Umum,0.0,0,6281554568727,0," QMQW+V97, Jl. Wolter Monginsidi, Pakem, Kranjingan, Kec. Sumbersari, Kabupaten Jember, Jawa Timur"
Master billiard,Studio Fotografi,4.6,97,6281298255333,0,
Nagee Gaming,Toko Penyewaan Video Game,3.7,24,,0," Jl. Gatot Subroto No.26 Lantai 3, Kampungtengah, Kepatihan, Kec. Kaliwates, Kabupaten Jember, Jawa Timur 68111"
