Nama,Rating,Jumlah Ulasan,Website,NoTelp,Alamat,Status
PT INKA (Persero) Banyuwangi,"4,7",127,https://www.inka.co.id/,8113476740,"Jalan INKA Banyuwangi, Lkr. Kp. Baru, Bulusan, Kec. Kalipuro, Kabupaten Banyuwangi, Jawa Timur 68455",Cold Prospek
PT. Pelindo Properti Indonesia Boom Marina Banyuwangi,"4,5",250,null,333423282,"Jl. Ikan Cucut No.27, Kampungmandar, Kec. Banyuwangi, Kabupaten Banyuwangi, Jawa Timur 68419",Cold Prospek
Sun Osing Beach,"4,5",2200,null,82216211211,"Jl. Situbondo - Banyuwangi No.112, Lkr. Kp. Baru, Bulusan, Kec. Kalipuro, Kabupaten Banyuwangi, Jawa Timur 68455",Cold Prospek
Plutos Billiards,"4,9",29,null,8121776869,"Jl. Kh. Hasyim Asyari, Dusun Krajan, Genteng Wetan, Kec. Genteng, Kabupaten Banyuwangi, Jawa Timur 68465",Hot Prospek
Alocasia Cafe and Eatery,"4,5",246,null,null,"Jl. Riau Gg. Paving, Krajan Barat, Sumbersari, Kec. Sumbersari, Kabupaten Jember, Jawa Timur",Cold Prospek
NAVAS,"4,6",426,null,895320805152,"Jl. Veteran No.3, Wetan Ktr., Jemberlor, Kec. Patrang, Kabupaten Jember, Jawa Timur 68118",Cold Prospek
PT. Wijaya Cahaya Timber Tbk,"4,5",120,http://www.wijayacahayatimber.com/,3315450494,"Jl. Yos Sudarso, Gempal, Wirolegi, Kec. Sumbersari, Kabupaten Jember, Jawa Timur 68124",Cold Prospek
Ijen Bromo Toure,5,10,null,81252832610,null,Hot Prospek
Optimum Laundry Dry & Wet Cleaning,"4,9",133,null,85337370777,"Taman Baru, Kec. Banyuwangi, Kabupaten Banyuwangi, Jawa Timur",Cold Prospek
QWash Laundry Express,"4,9",118,null,8563558032,"Jl. Mataram No.10, Taman Baru, Kec. Banyuwangi, Kabupaten Banyuwangi, Jawa Timur 68412",Cold Prospek
Nusantara laundry express Banyuwangi,5,11,https://sites.google.com/view/nusantara-laundry/home,81215854945,"Jl. Ikan Gurami No.1, Karangrejo, Kec. Banyuwangi, Kabupaten Banyuwangi, Jawa Timur 68411",Cold Prospek
TRANS BLUE FIRE,"4,9",21,null,8113771199,null,Cold Prospek
SHAY LAUNDRY EXPRESS,"4,8",38,null,85233995558,"Jl. Ikan Mungsing No.1, Karangrejo, Kec. Banyuwangi, Kabupaten Banyuwangi, Jawa Timur 68411",Cold Prospek
PT Tujuh Impian Bersama (SEVEN DREAM GROUP),"4,4",39,null,331413589,"Jl. Cendrawasih No.9, Puring, Slawu, Kec. Patrang, Kabupaten Jember, Jawa Timur 68116",Cold Prospek
Bakso Kabut Bu Juhairiyah,"4,4",3069,null,81515303239,"Jl. Rasamala II, Krajan, Kemuning Lor, Kec. Arjasa, Kabupaten Jember, Jawa Timur 68191",Cold Prospek
Tempo Doeloe Kopitiam,"4,1",112,https://bit.ly/m/tempodoeloe,8995101010,"Jl. Diponegoro No.103, Tembaan, Kepatihan, Kec. Kaliwates, Kabupaten Jember, Jawa Timur 68137",Cold Prospek
WARUNG 4 MATA,"4,3",1198,null,81336583269,"Jl. Panjaitan No.74, Gumuk Kerang, Sumbersari, Kec. Sumbersari, Kabupaten Jember, Jawa Timur 68122",Cold Prospek
Go Travel Banyuwangi,5,12,gotravel.bwi,82331201148,null,Hot Prospek
Service MEIRA,5,1,null,82331705787,null,Hot Prospek
Gym Anggi,5,2,null,null,"WH5P+377, Area Sawah/Kebun, Banyuwangi, Kec. Manyar, Kabupaten Gresik, Jawa Timur 61151",Cold Prospek
Banyuwangi Fitness Center,"4,5",17,null,6282144206665,"Pantai Boom, Jl. Ikan Cucut, Kampungmandar, Kec. Banyuwangi, Kabupaten Banyuwangi, Jawa Timur",Hot Prospek
Wulf Gym Pilates Padel And Cafe Banyuwangi,5,59,null,null,"RT.4/RW.5, Dusun Sumberbening, Kesilir, Kec. Siliragung, Kabupaten Banyuwangi, Jawa Timur 68488",Cold Prospek
CAESAR FITNESS CENTER,"4,9",318,null,6282143993513,"Jl. MH.Tamrin No.140, Pengantigan, Kec. Banyuwangi, Kabupaten Banyuwangi, Jawa Timur 68414",Hot Prospek
GMG Fitness,5,3,null,6285124544358,"Jl. Raya Jember, Krajan, Kedayunan, Kabat, Kabupaten Banyuwangi, Jawa Timur 68461",Cold Prospek
Scarlet GYM,"4,8",15,null,null,"H57P+V4Q, Jl. Bulusari, Dusun Krajan, Jajag, Kec. Gambiran, Kabupaten Banyuwangi, Jawa Timur 68486",Cold Prospek
Square gym center,"4,9",10,null,6282117339018,"Jl. Yos Sudarso, Lingkungan Sukowidi, Klatak, Kec. Kalipuro, Kabupaten Banyuwangi, Jawa Timur 68421",Hot Prospek
ELITE GYM,5,13,null,6281226889643,"RT.03/RW.04, Limbul Rejo, Bagorejo, Kec. Srono, Kabupaten Banyuwangi, Jawa Timur 68471",Hot Prospek
99 JAJAG GYM,5,100,null,6285143839191,"Jl. PB Sudirman No.111b, Dusun Yosowinangun, Jajag, Kec. Gambiran, Kabupaten Banyuwangi, Jawa Timur 68486",Hot Prospek
Gardenia Gym,"4,5",102,https://instagram.com/royalgymbwi?igshid=MzRlODBiNWFlZA==,6282125252773,"Q955+J75, Sobo, Kec. Banyuwangi, Kabupaten Banyuwangi, Jawa Timur 68419",Hot Prospek
AMM Fitnes Center,"4,9",87,http://amm-fitnescenter.blogspot.com/,6281235114897,"H84H+66, Dusun Krajan, Kedungrejo, Kec. Muncar, Kabupaten Banyuwangi, Jawa Timur",Hot Prospek
Java Gym Fitness,"4,8",23,null,null,"Jl. KH. Wahid Hasyim No.41, Dusun Krajan, Genteng Kulon, Kec. Genteng, Kabupaten Banyuwangi, Jawa Timur 68465",Cold Prospek
Mendut Sport Center,"4,1",698,null,6281358828836,"Jl. Mendut Regency No.M-3, Taman Baru, Kec. Banyuwangi, Kabupaten Banyuwangi, Jawa Timur 68416",Hot Prospek
Abiyyu Gym,5,10,null,6282326018808,"H6CJ+J66, Jl. Banyuwangi, Krajan, Benculuk, Kec. Cluring, Kabupaten Banyuwangi, Jawa Timur 68482",Cold Prospek
ALMIRA BFC,"4,4",34,null,6281217497789,"Lingkungan Jl. Gajah Mada No.30, Lingkungan Mojoroto R, Penataban, Kec. Giri, Kabupaten Banyuwangi, Jawa Timur 68422",Hot Prospek
Sinar Gym,"4,7",6,null,6285748302157,"M6W5+297, Dusun Klontang, Gendoh, Kec. Sempu, Kabupaten Banyuwangi, Jawa Timur 68468",Cold Prospek
Salim Fitnes Club,"4,3",26,null,6282338201402,"Jl. Perumahan Griya Gurit Permai No.13-14 BLOK S, Dsn. Gurit, Pengatigan, Kec. Rogojampi, Kabupaten Banyuwangi, Jawa Timur 68462",Hot Prospek
New Papo Gym,5,20,null,6281235452540,"Jl. Brawijaya No.40, Lingkungan Cuking Rw., Mojopanggung, Kec. Giri, Kabupaten Banyuwangi, Jawa Timur 68425",Hot Prospek
boy gym fitnes centre,"4,2",13,null,6281234604449,"jalan mangaran-bimorejo bajulmati, Krajan, Bajulmati, Kec. Wongsorejo, Kabupaten Banyuwangi, Jawa Timur 68453",Cold Prospek
Kerut Gym,"4,5",11,null,6281334119288,"Curah Jati, Grajagan, Purwoharjo, Banyuwangi Regency, East Java 68483",Cold Prospek
ABILAWA GYM,"4,5",27,null,null,"Dusun Tegalgondo, Kajarharjo, Kec. Kalibaru, Kabupaten Banyuwangi, Jawa Timur",Cold Prospek
Indian Gym,"4,5",44,null,628124951716,"Blangkon, Kebaman, Kec. Srono, Kabupaten Banyuwangi, Jawa Timur 68482",Hot Prospek
MUSCLE GYM,5,7,null,6282337833100,"JALAN JURUSAN JAJAG, Dusun Kepatihan, Cluring, Kec. Cluring, Kabupaten Banyuwangi, Jawa Timur 68482",Cold Prospek
Stut Gym & Studio,5,6,null,6285607158987,"Unnamed Road, Krajan, Purwoharjo, Kec. Purwoharjo, Kabupaten Banyuwangi, Jawa Timur 68483",Cold Prospek
Zulia Gym,"4,8",37,null,6281233152849,"Unnamed Road, Taman Suruh, Bangorejo, Banyuwangi Regency, East Java 68487",Hot Prospek
Glenfit Gym Glenmore,"4,9",8,null,6281233590409,"Jl. Raya Ps., Sep Wetan, Sepanjang, Kec. Glenmore, Kabupaten Banyuwangi, Jawa Timur 68466",Cold Prospek
KEBOLAJER GYM,"4,9",14,null,null,"Dusun Krajan, Genteng Wetan, Kec. Genteng, Kabupaten Banyuwangi, Jawa Timur 68465",Cold Prospek
Wall Climbing FPTI Banyuwangi,5,3,null,null,"Lingkungan Cuking Rw., Mojopanggung, Kec. Giri, Kabupaten Banyuwangi, Jawa Timur 68425",Cold Prospek
WA GYM,"4,5",2,null,null,"Dusun Krajan, Wringin Putih, Kec. Muncar, Kabupaten Banyuwangi, Jawa Timur 68472",Cold Prospek
Arysta Gym,"4,5",35,https://www.ob-fit.com/,null,"Pancoran Kulon, Rogojampi, Kec. Rogojampi, Kabupaten Banyuwangi, Jawa Timur 68462",Cold Prospek
OB Fitness Health - Banyuwangi,5,2,https://www.ob-fit.com/,628164711020,"Jl. Jend. Sudirman No.85, Panderejo, Kec. Banyuwangi, Kabupaten Banyuwangi, Jawa Timur 68415",Cold Prospek
Indian Gym 3,"4,3",3,null,null,"Jl. Ikan Tongkol No.rt 05/01, Palurejo, Sumbersewu, Kabupaten Banyuwangi, Jawa Timur 68472",Cold Prospek
Komang Gym,4,49,null,null,"Jl. Sumberwadung, Tugung, Sempu, Kec. Sempu, Kabupaten Banyuwangi, Jawa Timur 68468",Cold Prospek
HERO GYM,"4,4",15,null,null,"Jl. Srawet Indah No.184, Kebonrejo, Kebondalem, Kec. Bangorejo, Kabupaten Banyuwangi, Jawa Timur 68487",Cold Prospek
kopi jotos,"4,6",656,null,6285646411679,"Jl. Panglima Besar Sudirman No.33, Penganjuran, Panderejo, Kec. Banyuwangi, Kabupaten Banyuwangi, Jawa Timur 68415",Hot Prospek
Atap Langit Coffee,"4,8",547,null,null,"Jl. MH.Tamrin, Pengantigan, Kec. Banyuwangi, Kabupaten Banyuwangi, Jawa Timur 68414",Cold Prospek
Osing Deles Cafe & Resto,"4,5",1965,null,6283852126581,"Jl. K.H. Agus Salim No.12A, Taman Baru, Kec. Banyuwangi, Kabupaten Banyuwangi, Jawa Timur 68416",Hot Prospek
DC Coffee Banyuwangi,"4,7",39,https://www.instagram.com/tommunity.sudirman?igsh=MWVzb2p5M2E2djhjMg==,6282233510362,"Jl. Sritanjung No.8, Temenggungan, Kec. Banyuwangi, Kabupaten Banyuwangi, Jawa Timur 68411",Hot Prospek
Tomoro Coffee and Pastry Sudirman Banyuwangi,"4,9",735,https://www.instagram.com/tommunity.sudirman?igsh=MWVzb2p5M2E2djhjMg==,6285198185858,"Jl. Panglima Besar Sudirman No.69, Panderejo, Kec. Banyuwangi, Kabupaten Banyuwangi, Jawa Timur 68432",Hot Prospek
Dominance Coffee,"4,5",213,null,null,"Jl. Kertanegara No.10 A, Kebalenan, Kec. Banyuwangi, Kabupaten Banyuwangi, Jawa Timur 68417",Cold Prospek
Kunci Kuppi - Cafe & Bakehouse,"4,9",267,https://kuncikuppi.com/the-philosophy-of-kaizen-at-kuncikuppi-banyuwangi,6285158690244,"Pancoran Banjarsari, Glagah, Banyuwangi Regency, East Java 68454",Cold Prospek
Steven Coffee,"4,9",350,null,6282244992833,"Jl. Kolonel Sugiono No.11, Kertosari, Tukangkayu, Kec. Banyuwangi, Kabupaten Banyuwangi, Jawa Timur 68416",Hot Prospek
1911 Cafe & Resto,"4,6",1324,null,6287782252564,"Jl. Perkebunan Kalibendo, Kec. Glagah, Kabupaten Banyuwangi, Jawa Timur 68454",Hot Prospek
Indische 1931 Banyuwangi,"4,5",207,null,6282143914039,"Jl. Singosari, Taman Baru, Banyuwangi, Jawa Timur 68416",Hot Prospek
Zazito Co-Working Cafe,"4,9",205,https://instagram.com/zazito11,6285335109185,"Jl. Karang Asem, Taman Baru, Kec. Banyuwangi, Kabupaten Banyuwangi, Jawa Timur 68416",Hot Prospek
Warunk Loji,"4,5",1018,null,6282141407272,"Jl. Jenderal Ahmad Yani No.01, Penganjuran, Tukangkayu, Kec. Banyuwangi, Kabupaten Banyuwangi, Jawa Timur 68416",Cold Prospek
KoHay! Coffee Shop,"4,7",474,null,6285156299562,"Jl Raya Srono 229, Kebaman, Kec. Srono, Kabupaten Banyuwangi, Jawa Timur 68471",Hot Prospek
Serasa Coffee & Working Space,"4,1",135,https://www.instagram.com/serasacoffee.id?igsh=bDB5eHN3MWo5aTBp,6281330981067,"Jl. Jend. Sudirman No.123, Singonegaran, Kec. Banyuwangi, Kabupaten Banyuwangi, Jawa Timur 68461",Hot Prospek
Ndalem Coffee And Roastery Kalasan,"4,9",131,null,6281333282248,"Jl. Kalasan No.5, Penganjuran, Kec. Banyuwangi, Kabupaten Banyuwangi, Jawa Timur 68419",Hot Prospek
Insight Banyuwangi,"4,9",59,null,6282257294589,"Jl. Supriyadi No.2, Penganjuran, Kec. Banyuwangi, Kabupaten Banyuwangi, Jawa Timur 68416",Hot Prospek
Tres cafe,"4,8",16,null,6281358866809,"Jl. Kopral Talab No.17, Tukangkayu, Kec. Banyuwangi, Kabupaten Banyuwangi, Jawa Timur 68415",Cold Prospek
Kepompong Seaview,"4,5",638,null,6281133335557,"Pancoran, Ketapang, Kec. Kalipuro, Kabupaten Banyuwangi, Jawa Timur",Hot Prospek
D&A Cafe,"4,9",25,null,6285236328990,"Jl. Kepiting No.60, Tukangkayu, Kec. Banyuwangi, Kabupaten Banyuwangi, Jawa Timur 68416",Cold Prospek
Moxie Coffee and Eatery,"4,6",52,null,6281133303888,"Jl. Brawijaya, Mojopanggung, Kec. Giri, Kabupaten Banyuwangi, Jawa Timur 68425",Hot Prospek
Coffee Republic,"4,6",53,null,6282144142243,"Jl. MH.Tamrin No.45, Pengantigan, Kec. Banyuwangi, Kabupaten Banyuwangi, Jawa Timur 68414",Hot Prospek
Omah kiyambak cafe & resto (OMKIM) Banyuwangi,"4,8",298,http://lynk.id/omkimcafeandresto,6287836681691,"Jl. Simpang Gajah Mada No.3, Mojopanggung, Kec. Giri, Kabupaten Banyuwangi, Jawa Timur 68425",Hot Prospek
Toko Kopi Sumber Rejeki,"4,8",488,null,6281249936060,"Jl. Kolonel Sugiono No.21, Tukangkayu, Kec. Banyuwangi, Kabupaten Banyuwangi, Jawa Timur 68416",Hot Prospek
Kedai Katrok Kertosari,"4,4",498,null,6285236627260,"Jl. Kolonel Sugiono No.1-19, Kertosari, Kec. Banyuwangi, Kabupaten Banyuwangi, Jawa Timur 68416",Hot Prospek
Dante's Cafe,"4,6",41,null,null,"Taman Baru, Kec. Banyuwangi, Kabupaten Banyuwangi, Jawa Timur 68416",Cold Prospek
TILU,"4,6",175,https://instagram.com/tilucafe?igshid=YmMyMTA2M2Y=,6285951641999,"Jl. Kolonel Sugiono No.2a, Tukangkayu, Kec. Banyuwangi, Kabupaten Banyuwangi, Jawa Timur 68416",Hot Prospek
Padi's coffe and Eatery,"4,4",42,http://kopipadis.semestakreasindo.com/,6281943603790,"Jl. Mendut Gg. 5, Taman Baru, Kec. Banyuwangi, Kabupaten Banyuwangi, Jawa Timur 68416",Cold Prospek
Umarasa cafe & Resto,"4,5",278,null,6281259244051,"Jl. Adi Sucipto No.44, Sobo, Kec. Banyuwangi, Kabupaten Banyuwangi, Jawa Timur 68418",Hot Prospek
New Banyuwangi Sport,5,3,null,6282233881569,"Jl. Kembang Jepun No.127 D, Bongkaran, Kec. Pabean Cantian, Surabaya, Jawa Timur 60161",Cold Prospek
AOS Grosir Banyuwangi,"4,4",19,null,6282337000939,"Jl. Ikan Lumba-lumba No.2, Karangrejo, Kec. Banyuwangi, Kabupaten Banyuwangi, Jawa Timur 68411",Hot Prospek
POMO GROSIR,"4,8",70,https://linktr.ee/qshopbwi,6287770330937,"Jl. Raya Grajagan No.15, Krajan, Purwoharjo, Kec. Purwoharjo, Kabupaten Banyuwangi, Jawa Timur 68483",Hot Prospek
Qshop grosir,"4,7",34,https://linktr.ee/qshopbwi,62895621082763,"Jl. Dahlia, Krajan Satu, Boyolangu, Kec. Giri, Kabupaten Banyuwangi, Jawa Timur 68424",Hot Prospek
Bares Rogojampi,"4,4",989,https://shopee.co.id/baressupermarket?smtt=0.237151188-1662455553.9,6281234604410,"Jl. Raya Petung No.16, Krajan, Kedaleman, Kec. Rogojampi, Kabupaten Banyuwangi, Jawa Timur 68462",Cold Prospek
PT BARES GROSIR 1,"4,4",2063,http://bit.ly/TokoBARESGROSIR,6281230456608,"Jl. Gajah Mada No.113-115, Dusun Sawahan, Genteng Kulon, Kec. Genteng, Kabupaten Banyuwangi, Jawa Timur 68465",Cold Prospek
Bintang Shopping Center Alat Tulis,"4,6",331,https://www.instagram.com/tv/CbbO8wOotzQ/?utm_medium=copy_link,6282244068636,"Jl. K.H. Agus Salim No.40, Taman Baru, Kec. Banyuwangi, Kabupaten Banyuwangi, Jawa Timur 68417",Hot Prospek
Amels Hijab Grosir dan Ecer,"4,6",58,null,6283111743749,"Jl. Kolonel Sugiono No.7, Tukangkayu, Kec. Banyuwangi, Kabupaten Banyuwangi, Jawa Timur 68416",Hot Prospek
Pusat Grosir Teh Herbal Q,5,11,https://linktr.ee/pusatgrosir_tehherbalq,6282331656707,"Jl. Cemara, Kebalenan, Kec. Banyuwangi, Kabupaten Banyuwangi, Jawa Timur 68417",Hot Prospek
Toko Turky Sulaiman perlengkapan ibadah lengkap dan pusat grosir Alquran dan kitab,"4,9",245,null,6281515650551,"Jl. MH.Tamrin, Singonegaran, Kec. Banyuwangi, Kabupaten Banyuwangi, Jawa Timur 68414",Hot Prospek
Toko Crystal Banyuwangi,"4,4",48,https://www.crystalgrosir.com/,6282146361800,"Jl. Brawijaya No.1, Kebalenan, Kec. Banyuwangi, Kabupaten Banyuwangi, Jawa Timur 68417",Cold Prospek
Enestu Grosir,4,37,null,6281359434200,"Perum. Villa Bukit Mas Blok EE18, Giri, Kec. Banyuwangi, Kabupaten Banyuwangi, Jawa Timur 68423",Hot Prospek
Toko Menara Plastik,"4,8",456,null,6282123537171,"Jl. Piere Tendean No.10, Karangrejo, Kec. Banyuwangi, Kabupaten Banyuwangi, Jawa Timur 68411",Hot Prospek
GROSIR ALQISHOP BANYUWANGI (G.A.B),5,2,null,6282245670500,"Watubuncul, Banjarsari, Kec. Glagah, Kabupaten Banyuwangi, Jawa Timur 68432",Cold Prospek
TOKO GROSIR 20A,"4,8",6,null,628124920257,"Jl. Imam Bonjol No.66, Karangrejo, Kec. Banyuwangi, Kabupaten Banyuwangi, Jawa Timur 68411",Cold Prospek
Bares Reseller,"4,4",215,https://baresgrosir.blogspot.com/2020/03/toko-online-bares-grosir.html,6281358701578,"Jl. Jember No.74a, Setail, Kec. Genteng, Kabupaten Banyuwangi, Jawa Timur 68465",Cold Prospek
Toko grosir sembako,0,0,null,6289691641911,"Jl. Villa Bukit Mas, Pengantigan, Kec. Banyuwangi, Kabupaten Banyuwangi, Jawa Timur 68414",Cold Prospek
BERKAT JAYA Banyuwangi,5,2,null,6282229440879,"Jl. Ikan Tongkol, Kertosari, Kec. Banyuwangi, Kabupaten Banyuwangi, Jawa Timur",Cold Prospek
Laris Textile,"4,5",2108,http://facebook.com/laristextile,62333421051,"Jl. Letjen Di. Panjaitan No.13, Lateng, Kec. Banyuwangi, Kabupaten Banyuwangi, Jawa Timur 68413",Hot Prospek
Gamis & Kerudung Murah Ecer Grosir,5,1,null,6285755564331,"Dusun Kp. Baru, Jajag, Kec. Gambiran, Kabupaten Banyuwangi, Jawa Timur 68486",Cold Prospek
Hani grosir & Dapur Arke,"4,6",8,https://m.facebook.com/profile.php?id=100008579643619,6282234176050,"Jl. Sobo Kartika, Sobo, Kec. Banyuwangi, Kabupaten Banyuwangi, Jawa Timur 68418",Cold Prospek
Toko Slamet,"4,2",29,null,null,"Jl. Surati, Temenggungan, Kec. Banyuwangi, Kabupaten Banyuwangi, Jawa Timur 68412",Cold Prospek
Grosir Snack Banyuwangi,0,0,null,null,"Jl. Villa Bukit Mas No.38, Giri, Kec. Banyuwangi, Kabupaten Banyuwangi, Jawa Timur 68414",Cold Prospek
Toko KITA SEMBAKO,"4,4",9,null,null,"Genteng Kulon, Kec. Genteng, Kabupaten Banyuwangi, Jawa Timur 68465",Cold Prospek
TOKO KONVEKSI STAR REVO GROSIR,4,2,null,null,"Pasar Gedung Wanita, Banyuwangi, Jawa Timur 68411",Cold Prospek
GROSIR BUAH,0,0,null,6282331344471,"Jl. Ikan Lumba-lumba No.7, Karangrejo, Kec. Banyuwangi, Kabupaten Banyuwangi, Jawa Timur 68411",Cold Prospek
Toko Grosir Jasmine,0,0,null,null,"Jl. Kolonel Sugiono No.36, Kertosari, Kec. Banyuwangi, Kabupaten Banyuwangi, Jawa Timur 68416",Cold Prospek
Toko fikfaz grosir sembako,5,1,null,6283140876914,"Jl. Bawean No.18, Klatak, Kec. Kalipuro, Kabupaten Banyuwangi, Jawa Timur 68421",Cold Prospek
UD. Murah Hati Grosir Beras Dan Eceran,4,2,null,https://crystalcosmetic.sirclo.me/id/products,"Mojopanggung, Kec. Giri, Kabupaten Banyuwangi, Jawa Timur 68425",Cold Prospek
Crystal Cosmetic,"4,9",373,https://crystalcosmetic.sirclo.me/id/products,6288804962521,"Jl. Panglima Besar Sudirman No.161-165, Kepatihan, Kec. Banyuwangi, Kabupaten Banyuwangi, Jawa Timur 68411",Cold Prospek
FIHARDI BUAH BANYUWANGI,1,2,null,6281384404392,"Jl. Mayor Supono No.23, Tukangkayu, Kec. Banyuwangi, Kabupaten Banyuwangi, Jawa Timur 68416",Cold Prospek
Toko Serba ada banyuwangi,"3,8",21,null,6282244969090,"Jl. Basuki Rahmat No.22, Lateng, Kec. Banyuwangi, Kabupaten Banyuwangi, Jawa Timur 68413",Hot Prospek
GROSIR TEH BANYUWANGI,0,0,https://www.instagram.com/grosirtehbanyuwangi,628818188800,"Jl. Brawijaya, Kebalenan, Kec. Banyuwangi, Kabupaten Banyuwangi, Jawa Timur",Cold Prospek
Billa Snack,"4,5",6,null,null,"Jl. Ikan Mas, Karangrejo, Kec. Banyuwangi, Kabupaten Banyuwangi, Jawa Timur 68411",Cold Prospek
Toko genteng UD Sinar Mulya Banyuwangi,5,3,null,null,"Jl. Brawijaya No.34, Mojopanggung, Kec. Giri, Kabupaten Banyuwangi, Jawa Timur 68425",Cold Prospek
Pusat grosir baju anak Banyuwangi | Naumy Kids,"4,8",5,https://instagram.com/naumykids?igshid=YmMyMTA2M2Y=,6282335527925,"Jl. Kolonel Sugiono, Tukangkayu, Kec. Banyuwangi, Kabupaten Banyuwangi, Jawa Timur 68413",Cold Prospek
Grosir Ayam Kampung Pejantan dan Bebek,5,8,null,6289506144162,"Jl. Prambanan No.77/23, Taman Baru, Kec. Banyuwangi, Kabupaten Banyuwangi, Jawa Timur 68416",Cold Prospek
Toko Laris,"4,6",9,null,null,"Sobo, Kec. Banyuwangi, Kabupaten Banyuwangi, Jawa Timur",Cold Prospek
Banyuwangi Raya Elektrik,5,5,null,null,"Jl. Letjen S Parman No.70, Sobo, Kec. Banyuwangi, Kabupaten Banyuwangi, Jawa Timur 68419",Cold Prospek
3Second Store Banyuwangi,"4,5",256,https://3second.co.id/stores/3-second-fs-banyuwangi,6281225100398,"Jl. Jenderal Ahmad Yani No.14, Penganjuran, Kec. Banyuwangi, Kabupaten Banyuwangi, Jawa Timur 68416",Cold Prospek
Mayang Collection Banyuwangi,5,191,https://linktr.ee/mayangcollection_official,6282142548391,"Jl. Jend. Sudirman No.194, Temenggungan, Kec. Banyuwangi, Kabupaten Banyuwangi, Jawa Timur 68418",Hot Prospek
Butik Teman Sehati,5,150,null,6282111111637,"Ruko Madania Residence, Genteng Wetan, Kec. Genteng, Kabupaten Banyuwangi, Jawa Timur 68465",Hot Prospek
Republik Using Kaos Banyuwangi,"4,6",204,null,6285230328662,"Dusun Watu Ulo, Banjarsari, Kec. Glagah, Kabupaten Banyuwangi, Jawa Timur 68432",Hot Prospek
Toko Grosir & Ecer Pakaian Noel fashion,5,1,null,6285771146631,"Jl. Kertanegara No.2, Kebalenan, Kec. Banyuwangi, Kabupaten Banyuwangi, Jawa Timur 68417",Cold Prospek
Ria Busana Banyuwangi,"4,7",85,null,6289697742754,"Jl. Jenderal Ahmad Yani No.62-27, Penganjuran, Kec. Banyuwangi, Kabupaten Banyuwangi, Jawa Timur 68416",Hot Prospek
OOTDSUPPLY store distro,"4,9",79,https://linktr.ee/ootdsupplystore,6282331373282,"Jl. KH. Wahid Hasyim No.125, Genteng, Kabupaten Banyuwangi, Jawa Timur 68468",Hot Prospek
nadien collection,5,2,null,6285749923777,"Jl. KH. Wahid Hasyim No.11, Penganjuran, Kec. Banyuwangi, Kabupaten Banyuwangi, Jawa Timur 68416",Cold Prospek
Yhushop official,"4,9",63,https://www.instagram.com/reel/CePy2oVproo/?igshid=YmMyMTA2M2Y=,6282231000614,"Griya Sobo Asri 2, Tukangkayu, Kec. Banyuwangi, Kabupaten Banyuwangi, Jawa Timur",Hot Prospek
Joeragan Tas Fashion and More Banyuwangi,"4,9",175,null,6282132623530,"Singotrunan, Lateng, Kec. Banyuwangi, Kabupaten Banyuwangi, Jawa Timur 68414",Hot Prospek
Ivaniar butik,"4,9",38,https://instagram.com/ivaniar.id?igshid=YmMyMTA2M2Y=,6287733508006,"Perum Citra Pesona Indah, Kertosari, Kabupaten Banyuwangi, Jawa Timur 68418",Hot Prospek
SANET,"4,8",40,https://sanet.co.id/,6287712992682,"Jl. Taman Sutri Indah, Sobo, Banyuwangi, Jawa Timur 68418",Cold Prospek
NAINAI ID,"4,4",10,null,6282345566456,"Jl. Adi Sucipto No.26, Taman Baru, Banyuwangi, Jawa Timur 68416",Cold Prospek
Vouk and Co Distro,5,11,null,623332890997,"Jl. Gajah Mada No.61, Penataban, Kec. Giri, Kabupaten Banyuwangi, Jawa Timur 68422",Cold Prospek
Elizabeth Banyuwangi,"4,4",796,http://elizabeth.co.id/,6282218136730,"Jl. Dr. Sutomo No.36, Panderejo, Banyuwangi, Jawa Timur 68415",Cold Prospek
Omeyog Apparel,5,14,https://instagram.com/omeyogapparel?igshid=M2RkZGJiMzhjOQ==,628814075407,"Jl. Kertanegara Blk. A No.01, Kebalenan, Banyuwangi, Jawa Timur 68417",Cold Prospek
Amels Hijab Grosir dan Ecer,"4,6",58,null,6283111743749,"Jl. Kolonel Sugiono No.7, Tukangkayu, Banyuwangi, Jawa Timur 68416",Hot Prospek
Toko baju regstuff,1,1,null,null,"Jl. Ikan Tongkol No.56, Kertosari, Banyuwangi, Jawa Timur 68418",Cold Prospek
Momo Accesories Banyuwangi,"4,9",1363,null,6285859722220,"Jl. Adi Sucipto No.29A, Tukangkayu, Banyuwangi, Jawa Timur 68416",Hot Prospek
Aufaa Store Banyuwangi,"4,9",18,null,6287800651712,"Jl. Sayu Wiwit Gg. Kelinci No.7, Banyuwangi, Jawa Timur 68412",Hot Prospek
Toko Assegaff Busana Muslim,"4,7",16,null,62811358405,"Jl. Basuki Rahmat No.45, Banyuwangi, Jawa Timur 68414",Hot Prospek
Benidson Store Banyuwangi,5,2,null,null,"Jl. MT Haryono, Banyuwangi, Jawa Timur 68411",Cold Prospek
ARINI Fashion,5,1,null,6281210949994,"Dusun Krajan, Srono, Kabupaten Banyuwangi, Jawa Timur 68471",Cold Prospek
Mom's nauna,"4,5",32,null,6285234576080,"Jl. Prambanan No.63, Banyuwangi, Jawa Timur 68417",Hot Prospek
Osing Ningrat Batiks,"4,2",53,null,623333381710,"Jl. Adi Sucipto No.63, Banyuwangi, Jawa Timur 68418",Hot Prospek